{
  "manifest": {
    "artifact_version": "fixture-2026-09-v1",
    "generated_at": "2026-09-21T00:00:00Z",
    "code_commit": "development-fixture",
    "run_id": "synthetic-fixture",
    "dataset_releases": [],
    "display_status": "illustrative"
  },
  "context": {
    "condition_id": "long-covid-current",
    "cohort_id": "current-long-covid-adults-18-64",
    "age_range": "18–64",
    "evidence_year": 2024,
    "geography_scope": "United States national evidence",
    "local_context_id": "wv-working-context",
    "severity_filter": null,
    "artifact_version": "fixture-2026-09-v1"
  },
  "burden_domains": [
    {
      "domain_id": "economic-healthcare",
      "label": "Economic / healthcare burden",
      "availability_state": "partial",
      "limitations": [
        "All displayed values are illustrative development fixtures, not analytical outputs."
      ],
      "measures": [
        {
          "estimate_id": "fixture-population",
          "measure_id": "represented-population",
          "label": "Represented population",
          "value": 6800000,
          "unit": "people",
          "interval_low": 5800000,
          "interval_high": 7800000,
          "interval_type": "illustrative range",
          "denominator": "Adults 18–64 reporting current Long COVID",
          "universe": "US civilian noninstitutionalized population",
          "system_boundary": "National descriptive burden",
          "evidence_type": "survey_estimate",
          "release_status": "preliminary",
          "display_status": "illustrative",
          "source_ref": "synthetic-fixture",
          "artifact_version": "fixture-2026-09-v1",
          "allowed_interpretation": "Illustrative UI fixture only.",
          "prohibited_interpretation": [
            "analytical finding",
            "state prevalence"
          ],
          "limitations": [
            "Not generated from survey microdata."
          ]
        },
        {
          "estimate_id": "fixture-gross-spending",
          "measure_id": "gross-all-cause-spending",
          "label": "Gross annual all-cause spending",
          "value": 34000000000,
          "unit": "USD/year",
          "interval_low": 28000000000,
          "interval_high": 40000000000,
          "interval_type": "illustrative range",
          "denominator": "Adults 18–64 reporting current Long COVID",
          "universe": "US civilian noninstitutionalized population",
          "system_boundary": "National all-cause medical spending",
          "evidence_type": "survey_estimate",
          "release_status": "preliminary",
          "display_status": "illustrative",
          "source_ref": "synthetic-fixture",
          "artifact_version": "fixture-2026-09-v1",
          "allowed_interpretation": "Illustrative gross burden fixture.",
          "prohibited_interpretation": [
            "attributable cost",
            "diagnostic-delay cost",
            "savings",
            "local spending"
          ],
          "limitations": [
            "Not generated from MEPS."
          ]
        },
        {
          "estimate_id": "fixture-mean-spending",
          "measure_id": "mean-medical-spending",
          "label": "Mean annual medical spending",
          "value": 5000,
          "unit": "USD/person/year",
          "interval_low": 4200,
          "interval_high": 5800,
          "interval_type": "illustrative range",
          "denominator": "Represented population",
          "universe": "US adults 18–64 with current Long COVID",
          "system_boundary": "National all-cause medical spending",
          "evidence_type": "survey_estimate",
          "release_status": "preliminary",
          "display_status": "illustrative",
          "source_ref": "synthetic-fixture",
          "artifact_version": "fixture-2026-09-v1",
          "allowed_interpretation": "Illustrative UI fixture only.",
          "prohibited_interpretation": [
            "causal cost",
            "payer savings"
          ],
          "limitations": [
            "Not generated from MEPS."
          ]
        }
      ]
    },
    {
      "domain_id": "healthcare-work-admin",
      "label": "Healthcare-work / administrative burden",
      "availability_state": "partial",
      "limitations": [
        "Measures remain separate and must not be summed."
      ],
      "measures": [
        {
          "estimate_id": "fixture-visit-time",
          "measure_id": "own-medical-visit-time",
          "label": "Own medical-visit time",
          "value": 42,
          "unit": "hours/person/year",
          "interval_low": null,
          "interval_high": null,
          "interval_type": null,
          "denominator": "Applicable adults",
          "universe": "Reference cohort",
          "system_boundary": "Healthcare work",
          "evidence_type": "survey_estimate",
          "release_status": "preliminary",
          "display_status": "illustrative",
          "source_ref": "synthetic-fixture",
          "artifact_version": "fixture-2026-09-v1",
          "allowed_interpretation": "Illustrative native-unit fixture.",
          "prohibited_interpretation": [
            "diagnostic delay caused time",
            "monetized burden"
          ],
          "limitations": [
            "Synthetic."
          ]
        },
        {
          "estimate_id": "fixture-paperwork",
          "measure_id": "paperwork-time",
          "label": "Healthcare paperwork time",
          "value": 12,
          "unit": "hours/person/year",
          "interval_low": null,
          "interval_high": null,
          "interval_type": null,
          "denominator": "Applicable adults",
          "universe": "Reference cohort",
          "system_boundary": "Administrative healthcare work",
          "evidence_type": "survey_estimate",
          "release_status": "preliminary",
          "display_status": "illustrative",
          "source_ref": "synthetic-fixture",
          "artifact_version": "fixture-2026-09-v1",
          "allowed_interpretation": "Illustrative native-unit fixture.",
          "prohibited_interpretation": [
            "combined navigation score"
          ],
          "limitations": [
            "Synthetic."
          ]
        },
        {
          "estimate_id": "fixture-bills",
          "measure_id": "bills-insurance-time",
          "label": "Bills / insurance time",
          "value": 10,
          "unit": "hours/person/year",
          "interval_low": null,
          "interval_high": null,
          "interval_type": null,
          "denominator": "Applicable adults",
          "universe": "Reference cohort",
          "system_boundary": "Administrative healthcare work",
          "evidence_type": "survey_estimate",
          "release_status": "preliminary",
          "display_status": "illustrative",
          "source_ref": "synthetic-fixture",
          "artifact_version": "fixture-2026-09-v1",
          "allowed_interpretation": "Illustrative native-unit fixture.",
          "prohibited_interpretation": [
            "combined navigation score"
          ],
          "limitations": [
            "Synthetic."
          ]
        }
      ]
    },
    {
      "domain_id": "mental-human",
      "label": "Mental-health / human burden",
      "availability_state": "partial",
      "limitations": [
        "PHQ-2/K6 are screens/distress measures, not diagnoses."
      ],
      "measures": [
        {
          "estimate_id": "phq2-not-released",
          "measure_id": "phq2",
          "label": "Depressive-symptom screen (PHQ-2)",
          "value": null,
          "unit": "proportion",
          "interval_low": null,
          "interval_high": null,
          "interval_type": null,
          "denominator": "Applicable respondents",
          "universe": "Reference cohort",
          "system_boundary": "Mental-health screening",
          "evidence_type": "survey_estimate",
          "release_status": "not_released",
          "display_status": "analytical_artifact",
          "source_ref": "pending-analysis",
          "artifact_version": "fixture-2026-09-v1",
          "allowed_interpretation": "No numeric interpretation until released.",
          "prohibited_interpretation": [
            "psychiatric diagnosis",
            "causal effect",
            "monetization"
          ],
          "limitations": [
            "Analysis not released."
          ]
        },
        {
          "estimate_id": "k6-not-released",
          "measure_id": "k6",
          "label": "Psychological distress (K6)",
          "value": null,
          "unit": "proportion",
          "interval_low": null,
          "interval_high": null,
          "interval_type": null,
          "denominator": "Applicable respondents",
          "universe": "Reference cohort",
          "system_boundary": "Nonspecific psychological distress",
          "evidence_type": "survey_estimate",
          "release_status": "not_released",
          "display_status": "analytical_artifact",
          "source_ref": "pending-analysis",
          "artifact_version": "fixture-2026-09-v1",
          "allowed_interpretation": "No numeric interpretation until released.",
          "prohibited_interpretation": [
            "psychiatric diagnosis",
            "causal effect",
            "monetization"
          ],
          "limitations": [
            "Analysis not released."
          ]
        }
      ]
    }
  ],
  "evidence": [
    {
      "evidence_id": "fixture-evidence-insufficient",
      "source": "Synthetic development record — not external evidence",
      "locator": "development fixture",
      "population": "not applicable",
      "condition_definition": "not applicable",
      "outcome": "causal savings",
      "effect_or_parameter": null,
      "uncertainty": null,
      "system_boundary": "scenario claim",
      "geography": "not applicable",
      "payer": "not applicable",
      "year": 2026,
      "limitations": [